{
  "title": "မြန်မာ စမ်းသပ်စာအုပ်",
  "author": "Fixture Author",
  "year": "2026",
  "language": "my",
  "identifier": "urn:uuid:00000000-0000-4000-8000-000000000001",
  "output_name": "book-mm",
  "cover": "cover/cover.png",
  "chapter_glob": "chapters/chapter-*.md",
  "part_glob": "chapters/part-*.md",
  "code_root": "../code"
}
